{
  "schema_version": "1.0",
  "generated_at": "2026-07-01",
  "repository_root": "/Users/mjm/Magenta",
  "scope": "Current Magenta Harness component inventory: general-harness runtime providers and declarations, TUI harness-facing interface modules, and AutOmicScience domain pack components. crates/magenta-hcp remains protocol-only and is not categorized as a Harness component.",
  "architecture_boundary": [
    "HCP is Harness Call Protocol/backplane, not a component category.",
    "Magnet is the connector layer for existing implementations mounted under HCP targets.",
    "General Harness is domain-free; packs are domain-specific.",
    "LLM-facing surface should stay light; this JSON is operator/debugging inventory, not prompt vocabulary."
  ],
  "summary": {
    "component_count": 111,
    "module_count": 13,
    "by_layer": {
      "general-harness": 74,
      "general-harness/kernel": 18,
      "crates/magenta-interface/tui": 2,
      "packs/AutOmicScience": 17
    },
    "by_kind": {
      "system-prompt": 1,
      "loop": 2,
      "event": 1,
      "event-tool": 2,
      "multiagent": 1,
      "adapter": 3,
      "hcp-process": 1,
      "recipe": 1,
      "agent-provider": 3,
      "hook": 9,
      "memory": 1,
      "sandbox": 5,
      "runtime": 7,
      "mcp": 18,
      "api": 1,
      "mcp-server": 1,
      "declared": 17,
      "skill": 12,
      "scaffold": 1,
      "session": 1,
      "trace": 1,
      "context": 1,
      "approval": 1,
      "shell": 2,
      "advisor": 1,
      "llm": 2,
      "eval": 1,
      "conflict": 1,
      "resolve": 1,
      "capability": 1,
      "surface": 1,
      "governance": 1,
      "tui": 2,
      "harness": 1,
      "process-tool": 2,
      "task-harness": 4
    },
    "by_source": {
      "magenta": 72,
      "lazypi": 4,
      "external-upstream": 4,
      "opencode": 1,
      "oh-my-pi": 12,
      "pi": 1,
      "domain-pack": 17
    },
    "by_language": {
      "Markdown": 34,
      "Rust": 94,
      "TOML": 60,
      "JSON": 2,
      "TypeScript": 2,
      "C": 1,
      "Python": 11
    }
  },
  "origin_relationship_legend": {
    "native": "Authored in Magenta for the current HCP/Magnet/Eventful Harness architecture.",
    "vendored/adapted": "Code package or substantial implementation is copied/adapted into this repo; evidence should include a local Reference_Repo path.",
    "reference/reimplemented": "Capability or design is clearly referenced, but implementation here is separate Magenta code.",
    "adapter-boundary/reference": "Only a boundary or compatibility target is declared; upstream is not copied into General Harness.",
    "external runtime boundary": "External runtime/SDK is named as an adapter boundary or dependency direction.",
    "domain-specific native pack": "Domain pack material under packs/, outside domain-free General Harness."
  },
  "source_references": {
    "magenta": {
      "label": "Magenta native",
      "relationship": "native",
      "reference_paths": [],
      "description": "Code and declarations authored in this repo for HCP, Magnet, and the native Eventful Harness Kernel."
    },
    "pi": {
      "label": "PI",
      "relationship": "vendored/adapted where explicitly noted",
      "reference_paths": [
        "Reference_Repo/pi-main/packages/tui",
        "Reference_Repo/pi-main/packages/ai",
        "Reference_Repo/pi-main/packages/coding-agent"
      ],
      "description": "PI is the clear source for the vendored TypeScript TUI package and a design reference for model/tool/session concepts."
    },
    "oh-my-pi": {
      "label": "oh-my-pi",
      "relationship": "reference/inspiration unless exact vendoring is listed",
      "reference_paths": [
        "Reference_Repo/oh-my-pi-main/packages/hashline",
        "Reference_Repo/oh-my-pi-main/packages/natives",
        "Reference_Repo/oh-my-pi-main/packages/ai",
        "Reference_Repo/oh-my-pi-main/packages/coding-agent"
      ],
      "description": "Reference for hashline, native tool concepts, richer model catalog/auth, snapcompact/session ideas, and agent runtime patterns."
    },
    "opencode": {
      "label": "OpenCode",
      "relationship": "adapter boundary/reference",
      "reference_paths": [
        "Reference_Repo/opencode-dev/packages/llm",
        "Reference_Repo/opencode-dev/packages/opencode/src/provider",
        "Reference_Repo/opencode-dev/packages/opencode/src/tool",
        "Reference_Repo/opencode-dev/packages/opencode/src/mcp"
      ],
      "description": "Referenced for provider routing/gateway/catalog separation and external comparison, not mounted as General Harness code."
    },
    "lazypi": {
      "label": "LazyPi",
      "relationship": "adapted UX concepts",
      "reference_paths": [
        "Reference_Repo/LazyPi-main/agent/extensions/background-jobs",
        "Reference_Repo/LazyPi-main/agent/extensions/shared",
        "Reference_Repo/LazyPi-main/agent/extensions/side-chat.ts"
      ],
      "description": "Reference for background job monitor, sub-agent/background shell UX, floating overlays, and side-chat concepts; Magenta renames Jobs to Events."
    },
    "mix-pi": {
      "label": "mix_pi",
      "relationship": "local reference snapshot",
      "reference_paths": [
        "Reference_Repo/mix_pi/.pi",
        "Reference_Repo/mix_pi/LAZYPI_README.md"
      ],
      "description": "Local mixed PI/LazyPi reference snapshot. Used as contextual reference only in the current inventory."
    },
    "external-upstream": {
      "label": "External upstream",
      "relationship": "external dependency/boundary",
      "reference_paths": [
        "https://github.com/modelcontextprotocol/rust-sdk",
        "https://github.com/bytecodealliance/wasmtime"
      ],
      "description": "External systems named by manifests as adapter or execution boundaries."
    },
    "domain-pack": {
      "label": "AutOmicScience pack",
      "relationship": "domain-specific pack code",
      "reference_paths": [
        "packs/AutOmicScience"
      ],
      "description": "Domain-specific omics harness pack under packs/, not Magenta core/general-harness."
    }
  },
  "modules": {
    "scaffold-posture": {
      "category": "native-provider",
      "layer": "general-harness/kernel",
      "summary": "Default posture and component registry loaded from general-harness/harness.toml.",
      "roots": [
        "general-harness/harness.toml",
        "general-harness/kernel/src/scaffold.rs"
      ],
      "primary_languages": [
        "Rust",
        "TOML"
      ],
      "source": "magenta",
      "components": [
        {
          "id": "runtime-provider:scaffold:default",
          "name": "default",
          "kind": "scaffold",
          "type": "native-provider",
          "status": "working",
          "targets": [
            "scaffold://default",
            "scaffold://general",
            "scaffold://magenta"
          ],
          "path": "general-harness/harness.toml",
          "impl": [
            "general-harness/kernel/src/scaffold.rs"
          ],
          "lang": [
            "TOML",
            "Rust"
          ],
          "origin": "magenta",
          "origin_rel": "native",
          "origin_confidence": "high",
          "refs": []
        }
      ]
    },
    "native-kernel-providers": {
      "category": "native-provider",
      "layer": "general-harness/kernel",
      "summary": "Rust HCP providers for sessions, trace, context, hooks, events, loops, governance, approval, resolve/conflict/eval, model surface, capability catalog, and routing.",
      "roots": [
        "general-harness/kernel/src"
      ],
      "primary_languages": [
        "Rust"
      ],
      "source": "magenta",
      "components": [
        {
          "id": "general-harness:multiagent:local",
          "name": "local",
          "kind": "multiagent",
          "type": "native-provider",
          "status": "working",
          "targets": [
            "multiagent://local"
          ],
          "path": "general-harness/components/providers/multiagent/local.md",
          "impl": [
            "general-harness/kernel/src/multiagent_provider.rs"
          ],
          "lang": [
            "Markdown",
            "Rust"
          ],
          "origin": "magenta",
          "origin_rel": "native",
          "origin_confidence": "high",
          "refs": []
        },
        {
          "id": "general-harness:hook:init",
          "name": "init",
          "kind": "hook",
          "type": "native-provider",
          "status": "working",
          "targets": [
            "hook://init"
          ],
          "path": "general-harness/components/providers/hooks/init/init.md",
          "impl": [
            "general-harness/kernel/src/hook_provider.rs"
          ],
          "lang": [
            "Markdown",
            "Rust"
          ],
          "origin": "magenta",
          "origin_rel": "native",
          "origin_confidence": "high",
          "refs": []
        },
        {
          "id": "general-harness:hook:pre-turn",
          "name": "pre-turn",
          "kind": "hook",
          "type": "native-provider",
          "status": "working",
          "targets": [
            "hook://pre-turn"
          ],
          "path": "general-harness/components/providers/hooks/pre-turn/pre-turn.md",
          "impl": [
            "general-harness/kernel/src/hook_provider.rs"
          ],
          "lang": [
            "Markdown",
            "Rust"
          ],
          "origin": "magenta",
          "origin_rel": "native",
          "origin_confidence": "high",
          "refs": []
        },
        {
          "id": "general-harness:hook:pre-llm",
          "name": "pre-llm",
          "kind": "hook",
          "type": "native-provider",
          "status": "working",
          "targets": [
            "hook://pre-llm"
          ],
          "path": "general-harness/components/providers/hooks/pre-llm/.gitkeep",
          "impl": [